[
  {
    "requestId": "11111111-1111-4111-8111-111111111111",
    "type": "hash_compute",
    "payloadSize": 2048,
    "priority": "normal",
    "precision": "full",
    "parameters": { "iterations": 16000, "itemId": 3 },
    "clientId": "sim-client-1",
    "arrivalTs": "2026-10-05T10:00:00.000Z"
  },
  {
    "requestId": "22222222-2222-4222-8222-222222222222",
    "type": "db_query",
    "payloadSize": 256,
    "priority": "high",
    "precision": "full",
    "parameters": { "itemId": 7 },
    "clientId": "sim-client-2",
    "arrivalTs": "2026-10-05T10:00:00.050Z"
  },
  {
    "requestId": "33333333-3333-4333-8333-333333333333",
    "type": "report_generate",
    "payloadSize": 4096,
    "priority": "low",
    "precision": "full",
    "parameters": { "iterations": 22000, "itemId": 1 },
    "clientId": "sim-client-3",
    "arrivalTs": "2026-10-05T10:00:00.120Z"
  },
  {
    "requestId": "44444444-4444-4444-8444-444444444444",
    "type": "image_resize",
    "payloadSize": 8192,
    "priority": "normal",
    "precision": "reduced",
    "parameters": { "itemId": 5 },
    "clientId": "sim-client-1",
    "arrivalTs": "2026-10-05T10:00:00.200Z"
  }
]
